{
    "$schema": "https://json-schema.org/draft/2020-12/schema",
    "title": "Extension config",
    "description": "The data of an extension in extensions/. `npm run sync:extensions` derives the extension's files from it.",
    "type": "object",
    "additionalProperties": false,
    "required": ["name", "friendlyName", "sample", "cspell", "commands"],
    "properties": {
        "$schema": { "type": "string" },
        "name": {
            "description": "The extension's directory in extensions/. Also the default command ID prefix: `cSpellExt_<name>`.",
            "type": "string",
            "pattern": "^[a-z0-9]+(-[a-z0-9]+)*$"
        },
        "friendlyName": {
            "description": "The name shown to people, i.e. `Swedish`.",
            "type": "string",
            "minLength": 1
        },
        "displayName": {
            "description": "The Marketplace name. Default: `<friendlyName> - Code Spell Checker`.",
            "type": "string",
            "minLength": 1
        },
        "description": {
            "description": "The Marketplace description. Default: `<friendlyName> dictionary extension for VS Code.`",
            "type": "string",
            "minLength": 1
        },
        "sample": {
            "description": "The document opened by the VS Code test, relative to the extension.",
            "type": "string",
            "minLength": 1
        },
        "cspell": {
            "description": "The content of `cspell-ext.json`.",
            "type": "object"
        },
        "commands": {
            "description": "The commands the extension contributes.",
            "type": "array",
            "items": { "$ref": "#/$defs/command" }
        }
    },
    "$defs": {
        "command": {
            "type": "object",
            "additionalProperties": false,
            "required": ["action", "toggle", "value"],
            "properties": {
                "action": {
                    "description": "Turn the toggle on or off.",
                    "enum": ["enable", "disable"]
                },
                "toggle": {
                    "description": "What the command changes: a locale (`cSpell.language`), a dictionary (`cSpell.dictionaries`), or a file type (`cSpell.enabledFileTypes`).",
                    "enum": ["locale", "dictionary", "fileType"]
                },
                "value": {
                    "description": "The locale, dictionary name, or file type (language ID).",
                    "type": "string",
                    "minLength": 1
                },
                "scope": {
                    "description": "Where the setting is written. Not used by `fileType`. Default: `global`.",
                    "enum": ["global", "workspace"]
                },
                "id": {
                    "description": "The command ID. Default: `cSpellExt_<name>.<action>`, with `Workspace` appended for the workspace scope.",
                    "type": "string",
                    "minLength": 1
                },
                "title": {
                    "description": "The command title. Default: `<Action> <friendlyName> Spell Checker Dictionary`, with ` in Workspace` appended for the workspace scope.",
                    "type": "string",
                    "minLength": 1
                }
            },
            "if": { "properties": { "toggle": { "const": "fileType" } } },
            "then": { "not": { "required": ["scope"] } }
        }
    }
}
