{
    "$schema": "../../static/extension.config.schema.json",
    "name": "greek",
    "friendlyName": "Greek",
    "sample": "samples/seattle.md",
    "cspell": {
        "import": ["@cspell/dict-el/cspell-ext.json"]
    },
    "commands": [
        {
            "action": "enable",
            "toggle": "locale",
            "value": "el"
        },
        {
            "action": "disable",
            "toggle": "locale",
            "value": "el"
        },
        {
            "action": "enable",
            "toggle": "locale",
            "value": "el",
            "scope": "workspace"
        },
        {
            "action": "disable",
            "toggle": "locale",
            "value": "el",
            "scope": "workspace"
        }
    ]
}
