{
    "$schema": "../../static/extension.config.schema.json",
    "name": "esperanto",
    "friendlyName": "Esperanto",
    "sample": "samples/seattle.md",
    "cspell": {
        "import": ["@cspell/dict-eo/cspell-ext.json"]
    },
    "commands": [
        {
            "action": "enable",
            "toggle": "locale",
            "value": "eo",
            "id": "cSpellExt_esperanto.enableEsperanto"
        },
        {
            "action": "disable",
            "toggle": "locale",
            "value": "eo",
            "id": "cSpellExt_esperanto.disableEsperanto"
        },
        {
            "action": "enable",
            "toggle": "locale",
            "value": "eo",
            "scope": "workspace",
            "id": "cSpellExt_esperanto.enableEsperantoWorkspace"
        },
        {
            "action": "disable",
            "toggle": "locale",
            "value": "eo",
            "scope": "workspace",
            "id": "cSpellExt_esperanto.disableEsperantoWorkspace"
        }
    ]
}
